{
  "deck_version": "tymna-thrasios-treefarm-deckbuild006-v1",
  "deck_name": "Tymna the Weaver / Thrasios, Triton Hero \u2014 Tree Farm x CounterSlop (SIM-DECKBUILD-006 operative)",
  "commanders": [
    "Thrasios, Triton Hero",
    "Tymna the Weaver"
  ],
  "archetype_id": null,
  "role": "subject",
  "cards": [
    {
      "scryfall_id": "d2705b43-a94a-44c0-8740-82e0b296820c",
      "name": "Abhorrent Oculus",
      "quantity": 1
    },
    {
      "scryfall_id": "deadbeef-0001-4000-8000-000000000001",
      "name": "An Offer You Can't Refuse",
      "quantity": 1
    },
    {
      "scryfall_id": "bd3d4b4b-cf31-4f89-8140-9650edb03c7b",
      "name": "Ancient Tomb",
      "quantity": 1
    },
    {
      "scryfall_id": "f6589e02-8c84-4069-88d1-ebcc8520cae1",
      "name": "Archivist of Oghma",
      "quantity": 1
    },
    {
      "scryfall_id": "340c5799-4964-44dd-8c48-8f3f3aba5211",
      "name": "Badgermole Cub",
      "quantity": 1
    },
    {
      "scryfall_id": "bd7567df-b4d8-41a8-8eac-c05afa784bfe",
      "name": "Bayou",
      "quantity": 1
    },
    {
      "scryfall_id": "492c2f9a-51e7-4e0f-9899-23bf43ea988b",
      "name": "Birds of Paradise",
      "quantity": 1
    },
    {
      "scryfall_id": "b768efa2-e56b-4a7e-ace8-d673f10e0714",
      "name": "Birthing Pod",
      "quantity": 1
    },
    {
      "scryfall_id": "2135ac5a-187b-4dc9-8f82-34e8d1603416",
      "name": "Boseiju, Who Endures",
      "quantity": 1
    },
    {
      "scryfall_id": "b18fe7e0-8344-40cc-b242-83f01c6be7a6",
      "name": "Chord of Calling",
      "quantity": 1
    },
    {
      "scryfall_id": "f340cbf7-5bbe-45b9-a4bf-d1caa500ff93",
      "name": "Chrome Mox",
      "quantity": 1
    },
    {
      "scryfall_id": "c21565d0-fc40-4d89-9b27-87c03385e0af",
      "name": "City of Brass",
      "quantity": 1
    },
    {
      "scryfall_id": "71624139-a255-48be-93ca-594a4beba487",
      "name": "City of Traitors",
      "quantity": 1
    },
    {
      "scryfall_id": "c0516453-3e6a-4b7f-8df6-72a6e207169a",
      "name": "Clever Impersonator",
      "quantity": 1
    },
    {
      "scryfall_id": "f40bd797-4d12-4098-a1a8-d7e5b7b82ac9",
      "name": "Colossal Skyturtle",
      "quantity": 1
    },
    {
      "scryfall_id": "0548fb60-c843-4f8f-a029-6f10efc63a41",
      "name": "Command Tower",
      "quantity": 1
    },
    {
      "scryfall_id": "dca0a9a8-5ebc-43a3-8450-420ab6b7b76e",
      "name": "Commandeer",
      "quantity": 1
    },
    {
      "scryfall_id": "523414cb-f8db-407a-808a-01454e03d8b9",
      "name": "Crop Rotation",
      "quantity": 1
    },
    {
      "scryfall_id": "cfdb1c47-14be-491f-88b3-bed03489dbc5",
      "name": "Deathrite Shaman",
      "quantity": 1
    },
    {
      "scryfall_id": "71384418-173a-4f77-adab-56e52fa23692",
      "name": "Delighted Halfling",
      "quantity": 1
    },
    {
      "scryfall_id": "be219928-3d0e-4d00-b124-152ce8a8c13b",
      "name": "Delney, Streetwise Lookout",
      "quantity": 1
    },
    {
      "scryfall_id": "a24b4cb6-cebb-428b-8654-74347a6a8d63",
      "name": "Demonic Tutor",
      "quantity": 1
    },
    {
      "scryfall_id": "3a1d0dad-18a8-489e-ac11-08f64b72fda4",
      "name": "Derevi, Empyrial Tactician",
      "quantity": 1
    },
    {
      "scryfall_id": "22589a81-3ea8-4e78-98c9-c015e7539cf9",
      "name": "Devoted Druid",
      "quantity": 1
    },
    {
      "scryfall_id": "606caf13-c0d3-4a61-9a1a-32f13b6448ab",
      "name": "Eldritch Evolution",
      "quantity": 1
    },
    {
      "scryfall_id": "50aded92-f934-441f-8e48-d68d471e70d8",
      "name": "Elvish Spirit Guide",
      "quantity": 1
    },
    {
      "scryfall_id": "b770471c-1bf7-4179-8418-dcd790ca5405",
      "name": "Endurance",
      "quantity": 1
    },
    {
      "scryfall_id": "9d76a30c-0431-4334-892a-9822dda9671a",
      "name": "Enduring Vitality",
      "quantity": 1
    },
    {
      "scryfall_id": "1c9675fb-1a89-420f-aea8-50e0642f549c",
      "name": "Enlightened Tutor",
      "quantity": 1
    },
    {
      "scryfall_id": "f3537373-ef54-4578-9d05-6216420ee349",
      "name": "Esper Sentinel",
      "quantity": 1
    },
    {
      "scryfall_id": "d11c5fe0-1528-4c94-a8cc-42bcab9d7487",
      "name": "Exotic Orchard",
      "quantity": 1
    },
    {
      "scryfall_id": "bc9a7599-3c7d-4b83-bff3-e3d1f20f1b0f",
      "name": "Faerie Mastermind",
      "quantity": 1
    },
    {
      "scryfall_id": "f7f3dd95-bd14-4e0f-a388-444f9cf1b0dc",
      "name": "Fierce Guardianship",
      "quantity": 1
    },
    {
      "scryfall_id": "b10d99bf-b2ce-4443-b924-ff0eb8be1033",
      "name": "Finale of Devastation",
      "quantity": 1
    },
    {
      "scryfall_id": "71a98efb-9b0a-496b-ac21-8d70527ea544",
      "name": "Flare of Denial",
      "quantity": 1
    },
    {
      "scryfall_id": "8f85e12c-196b-4459-b81f-0c9c854e9f57",
      "name": "Flooded Strand",
      "quantity": 1
    },
    {
      "scryfall_id": "f900eeb7-7c45-44bc-ad3a-0bbe594ecf50",
      "name": "Flusterstorm",
      "quantity": 1
    },
    {
      "scryfall_id": "1825a719-1b2a-4af9-9cd2-7cb497cd0317",
      "name": "Force of Negation",
      "quantity": 1
    },
    {
      "scryfall_id": "89f612d6-7c59-4a7b-a87d-45f789e88ba5",
      "name": "Force of Will",
      "quantity": 1
    },
    {
      "scryfall_id": "deadbeef-0001-4000-8000-000000000002",
      "name": "Formidable Speaker",
      "quantity": 1
    },
    {
      "scryfall_id": "25b0b816-0583-44aa-9dc5-f3ff48993a51",
      "name": "Gaea's Cradle",
      "quantity": 1
    },
    {
      "scryfall_id": "7f273641-c5f3-48bc-b89e-3cff52d26a0b",
      "name": "Gemstone Caverns",
      "quantity": 1
    },
    {
      "scryfall_id": "8de3fdae-cc2c-4a14-b15b-4fe1a983dfbf",
      "name": "Gilded Drake",
      "quantity": 1
    },
    {
      "scryfall_id": "3b087bd4-bbb7-4963-bdb6-0a700ff19a04",
      "name": "Gleaming Splendor",
      "quantity": 1
    },
    {
      "scryfall_id": "deadbeef-0001-4000-8000-000000000003",
      "name": "Grand Abolisher",
      "quantity": 1
    },
    {
      "scryfall_id": "52af8b70-a9c8-40d7-99da-fa51dc293688",
      "name": "Hazel's Brewmaster",
      "quantity": 1
    },
    {
      "scryfall_id": "e71a6bd3-7478-4c3a-8ae0-98352ce28492",
      "name": "Imperial Seal",
      "quantity": 1
    },
    {
      "scryfall_id": "63cda4a0-0dff-4edb-ae67-a2b7e2971350",
      "name": "Kinnan, Bonder Prodigy",
      "quantity": 1
    },
    {
      "scryfall_id": "6ada256f-2e55-4c1f-b4d3-d7b10b498956",
      "name": "Sylvan Library",
      "quantity": 1
    },
    {
      "scryfall_id": "deadbeef-0001-4000-8000-000000000004",
      "name": "Lotho, Corrupt Shirriff",
      "quantity": 1
    },
    {
      "scryfall_id": "f85ab5f9-508e-45de-8fa1-ce1f16552ffc",
      "name": "Lotus Petal",
      "quantity": 1
    },
    {
      "scryfall_id": "504a69eb-3c2d-4bb1-b117-252b15acf0c2",
      "name": "Mana Confluence",
      "quantity": 1
    },
    {
      "scryfall_id": "c1a31d52-a407-4ded-bfca-cc812f11afa0",
      "name": "Mana Vault",
      "quantity": 1
    },
    {
      "scryfall_id": "9db3ba6d-eb7f-4f5b-9a3b-c6239c3baa42",
      "name": "Marsh Flats",
      "quantity": 1
    },
    {
      "scryfall_id": "61e9c6df-1c84-4eab-9076-a4feb6347c10",
      "name": "Mental Misstep",
      "quantity": 1
    },
    {
      "scryfall_id": "7536292c-da25-41c8-ba28-1e35758a7f3d",
      "name": "Minamo, School at Water's Edge",
      "quantity": 1
    },
    {
      "scryfall_id": "4f51140b-6254-431a-8810-94307bfdfbbe",
      "name": "Mindbreak Trap",
      "quantity": 1
    },
    {
      "scryfall_id": "88231c0d-0cc8-44ec-bf95-81d1710ac141",
      "name": "Misty Rainforest",
      "quantity": 1
    },
    {
      "scryfall_id": "deadbeef-0001-4000-8000-000000000005",
      "name": "Mockingbird",
      "quantity": 1
    },
    {
      "scryfall_id": "66024e69-ad60-4c9a-a0ca-da138d33ad80",
      "name": "Mox Amber",
      "quantity": 1
    },
    {
      "scryfall_id": "bf9fecfd-d122-422f-bd0a-5bf69b434dfe",
      "name": "Mox Diamond",
      "quantity": 1
    },
    {
      "scryfall_id": "40140991-cffa-4b52-9a25-37e9a8aa9ddd",
      "name": "Mystic Remora",
      "quantity": 1
    },
    {
      "scryfall_id": "1397d904-c51d-451e-8505-7f3118acc1f6",
      "name": "Nature's Rhythm",
      "quantity": 1
    },
    {
      "scryfall_id": "deadbeef-0001-4000-8000-000000000006",
      "name": "Neoform",
      "quantity": 1
    },
    {
      "scryfall_id": "400382a4-aea2-4827-b06a-1b0b3745908b",
      "name": "Noble Hierarch",
      "quantity": 1
    },
    {
      "scryfall_id": "a382a9b8-0b19-46c2-a547-a22d6e23d0ac",
      "name": "Oboro Breezecaller",
      "quantity": 1
    },
    {
      "scryfall_id": "7c024bae-5631-4e20-ac69-df392ac9e109",
      "name": "Orcish Bowmasters",
      "quantity": 1
    },
    {
      "scryfall_id": "486d7edc-d983-41f0-8b78-c99aecd72996",
      "name": "Otawara, Soaring City",
      "quantity": 1
    },
    {
      "scryfall_id": "1ed4c0bb-b710-44a1-b8bc-6bd11c27b8b8",
      "name": "Pact of Negation",
      "quantity": 1
    },
    {
      "scryfall_id": "6e288374-2b71-4ace-b1d2-a19fee6cb4af",
      "name": "Polluted Delta",
      "quantity": 1
    },
    {
      "scryfall_id": "af3928b4-813a-4120-8799-de34235d60ac",
      "name": "Ranger-Captain of Eos",
      "quantity": 1
    },
    {
      "scryfall_id": "9f37c5b6-a59c-45cd-9a99-e9357fe9ea1b",
      "name": "Rhystic Study",
      "quantity": 1
    },
    {
      "scryfall_id": "17913fb0-ef73-4b20-8625-b84d4e62178a",
      "name": "Runic Armasaur",
      "quantity": 1
    },
    {
      "scryfall_id": "b0d161fc-4a2a-4f1d-82b4-a746552552df",
      "name": "Savannah",
      "quantity": 1
    },
    {
      "scryfall_id": "deadbeef-0001-4000-8000-000000000007",
      "name": "Scalding Tarn",
      "quantity": 1
    },
    {
      "scryfall_id": "9d471e36-a3ab-4a96-ba4b-8eca921ea37a",
      "name": "Scrubland",
      "quantity": 1
    },
    {